{
  "$schema": "https://i2group.github.io/analyze-connect-node-sdk/schemas/config-schema-2.0.json",
  "serverPort": 3000,
  "connectorId": "nypd-connector",
  "ssl": {
    "enabled": false,
    "serverPort": 3443,
    "privateKeyFile": "",
    "certificateFile": "",
    "gatewayCN": "",
    "caCertificateFile": ""
  },
  "log": {
    "level": "info",
    "fileLogging": {
      "enabled": false,
      "dir": ""
    }
  }
}
